,Unnamed: 0,Produk,Rating,Ulasan,Tanggal,label,Cleaning
1075,1147,Cosmos Standing  Fan 16 SAE  ( 16 INCH),2,bayar hari rabu tapi baru dikirim kamis.  ditambah baru sampai di tangan hari sabtu.  padahal bayar delivery next day yang pricenya sama dengan harga barangnya.  tolong lebi. . .  ,2 bulan lalu,1,bayar hari rabu tapi baru dikirim kamis ditambah baru sampai di tangan hari sabtu padahal bayar delivery next day yang pricenya sama dengan harga barangnya tolong lebi
1076,1148,Cosmos Rice Cooker Non Stick CRJ-8228 B - 2.0L,5,barang aman  sampai tujuan,2 bulan lalu,1,barang aman sampai tujuan
1077,1149,Kipas Angin 16-PDB Electric Fan Twino (Meja dan Dinding),5,setelah di rangkai suaranya berisik,2 bulan lalu,1,setelah di rangkai suaranya berisik
1078,1150,Cosmos CB-281 G - Blender 2 L,5,barang original pengiriman cepat,2 bulan lalu,1,barang original pengiriman cepat
1079,1151,Cosmos CRJ-101 N - Rice Cooker 0.6 L,5,"produk mantap udah dicoba joss
seller responsive",2 bulan lalu,1,produk mantap udah dicoba joss seller responsive
1080,1152,Cosmos Rice Cooker Stainless Steel CRJ-9308 - 2 L,2,"pengiriman gak ada komplain,  cuman rice cookernya yang bermasalah.  nyoba masak beras 1 liter belom mateng tapi udah ctek duluan,  diulang lagi masaknya berkali kali tetep. . .  ",2 bulan lalu,1,pengiriman gak ada komplain cuman rice cookernya yang bermasalah nyoba masak beras liter belom mateng tapi udah ctek duluan diulang lagi masaknya berkali kali tetep
1081,1153,COSMOS RICE COOKER  NON STICK CRJ 3012 O candy series ,5,"bener2puas ama barang nya n pelayanan toko. . .  kondisi barang sampe dgn amam,  udh dites hasilnya nasi  matang, , , ,  watt kecil. . 👍",2 bulan lalu,1,benerpuas ama barang nya pelayanan toko kondisi barang sampe dgn amam udh dites hasilnya nasi matang watt kecil
1082,1154,Cosmos COTG-550 - Tritan Bottle 570 ml - Black,5,bagus original cuma minus di pengiriman yang super lama. .  20 hr mungkin baru sampai,2 bulan lalu,1,bagus original cuma minus di pengiriman yang super lama hr mungkin baru sampai
1083,1155,Cosmos CB-282 P - Blender 2 L,5,"produk original dan berfungsi dengan baik. 
produk lengkap dan aman tidak ada yg pecah atau rusak ,  cuma kecewa aja kirain tutupnya warna biru seperti yg digambar tau nya. . .  ",2 bulan lalu,1,produk original dan berfungsi dengan baik produk lengkap dan aman tidak ada yg pecah atau rusak cuma kecewa aja kirain tutupnya warna biru seperti yg digambar tau nya
1084,1156,Cosmos NEW AIR FRYER CAF-6603,5,produk original.  semoga awet. ,3 bulan lalu,1,produk original semoga awet
1085,1157,Cosmos Food Processor FP-323 KUBA NEW PRODUK,5,alhamdulillah sudah sampai dan berfungsi dengan baik.  insya allah awet.  terima kasih banyak.  ✌️,3 bulan lalu,1,alhamdulillah sudah sampai dan berfungsi dengan baik insya allah awet terima kasih banyak
1086,1158,Cosmos CRJ-9303 - Rice Cooker 2 L,5,puas,3 bulan lalu,1,puas
1087,1159,Cosmos Rice Cooker Harmond CRJ-6028 G - 1.2L Mama Suka,5,"sesuai diskripsi, sesuai dgn yg ingin sy beli, packing standar, respon penjual ok, over all ok, thx",3 bulan lalu,1,sesuai diskripsi sesuai dgn yg ingin sy beli packing standar respon penjual ok over all ok thx
1088,1160,Cosmos FP-300 - Food Processor 300 ml,5,"barang lengkap dan berfungsi sempurna.  tapi untuk menghaluskan bumbu hasilnya kasar,  karna mata pisaunya cuma 2. ",3 bulan lalu,1,barang lengkap dan berfungsi sempurna tapi untuk menghaluskan bumbu hasilnya kasar karna mata pisaunya cuma
1089,1161,Cosmos CB-282 G - Blender 2 L,5,barang sampai dengan selamat dan berfungsi,3 bulan lalu,1,barang sampai dengan selamat dan berfungsi
1090,1162,Cosmos CGS-123 P BROWN - Kompor Portable 1.45 Kg 1 Tungku NEW Looks,5,"keren udah ngincer dr lama,  alhamdulillah akhirnya bisa punya",3 bulan lalu,1,keren udah ngincer dr lama alhamdulillah akhirnya bisa punya
1091,1163,Cosmos CRJ-1001 N - Rice Cooker 0.6 L,5,"pesen sesuai gambar,  masa diksh wrn pink,  btw tq lah",3 bulan lalu,1,pesen sesuai gambar masa diksh wrn pink btw tq lah
1092,1164,Cosmos Blender - Food Processor - FP-313 Tosca - 1.2 liter,5,barang bagus berfungsi dengan baik,3 bulan lalu,1,barang bagus berfungsi dengan baik
1093,1165,Cosmos CB-171 P - Blender 1 L,5,bagus semoga awet :),3 bulan lalu,1,bagus semoga awet
1094,1166,Cosmos Setrika Uap Ceramic Soleplate CI-4910 C,4,biasa aja,3 bulan lalu,1,biasa aja
1095,1167,Cosmos Rice Cooker Non Stick CRJ-8228 B - 2.0L,5,"pengiriman cepat,  barang sesuai pesanan",3 bulan lalu,1,pengiriman cepat barang sesuai pesanan
1096,1168,WADESTA BESI SIF-1804 S,5,puas👍👍,3 bulan lalu,1,puas
1097,1169,Cosmos Food Processor FP-323 KUBA NEW PRODUK,5,barang sesuai deskripsi . .  packing aman . . . ,3 bulan lalu,1,barang sesuai deskripsi packing aman
1098,1170,Cosmos CRJ-101 N - Rice Cooker 0.6 L,5,kereenn,3 bulan lalu,1,kereenn
1099,1171,Cosmos CB-282 P - Blender 2 L,5,barang ok berfungsi dngan baik. . ,3 bulan lalu,1,barang ok berfungsi dngan baik
1100,1172,Cosmos CB-171 P - Blender 1 L,5,joss gandoss,3 bulan lalu,1,joss gandoss
1101,1173,Cosmos Blenz CB-802 - Blender 1.2 L,5,aman rapi,3 bulan lalu,1,aman rapi
1102,1174,Cosmos Rice Cooker Harmond CRJ-6028 G - 1.2L Mama Suka,5,nasi matang merata 👍 garansi terjamin mutu terjamin sni gampang dibersihkan,3 bulan lalu,1,nasi matang merata garansi terjamin mutu terjamin sni gampang dibersihkan
1103,1175,Cosmos Rice Cooker Non Stick CRJ-8228 B - 2.0L,5,"alhamdulillah, , ,  kondisi barang baru,  bagus dan pengemasan oke. . ",3 bulan lalu,1,alhamdulillah kondisi barang baru bagus dan pengemasan oke
1104,1176,Cosmos CRJ-3307 GMBORI,3,"bonus nya tidak ada, makasih",3 bulan lalu,1,bonus nya tidak ada makasih
1105,1177,"Cosmos WADESTA 16-S033 ONY - Kipas Angin 3in1-16 inch Wall,Desk,Stand",4,bagus sih cuman rada lecet sedikit tapi semoga aja awet,3 bulan lalu,1,bagus sih cuman rada lecet sedikit tapi semoga aja awet
1106,1178,Cosmos CRJ-9303 - Rice Cooker 2 L,3,"kualitas produk sangat bagus,  mudah2an awet,  hanya sedikit kecewa sama respon chat penjual yang lambat banget,  serta pengiriman yang lama padahal ini official store,  tern. . .  ",3 bulan lalu,1,kualitas produk sangat bagus mudahan awet hanya sedikit kecewa sama respon chat penjual yang lambat banget serta pengiriman yang lama padahal ini official store tern
1107,1179,Cosmos Rice Cooker Non Stick CRJ-3121 AF- 1.8L,5,gampang dibersihkan,3 bulan lalu,1,gampang dibersihkan
1108,1180,Cosmos 12 DSE - Kipas Angin Meja 12 inch,5,"produk ok sesuai deskripsi.  masukan saja utk admin,  kalo ditanya via chat harap respon jawabannya lebih cepat dan memuaskan pembeli. ",3 bulan lalu,1,produk ok sesuai deskripsi masukan saja utk admin kalo ditanya via chat harap respon jawabannya lebih cepat dan memuaskan pembeli
1109,1181,Cosmos COTG-540 - Tritan Bottle 400 ml - Purple,5,mantappp,3 bulan lalu,1,mantappp
1110,1182,Cosmos COTG-550 - Tritan Bottle 570 ml - Black,5,kereeeen,3 bulan lalu,1,kereeeen
1111,1183,Cosmos 16 SBI - Kipas Angin 2in1 16 inch (Stand & Desk),5,kipas angin berfungsi dgn baik dan cepat dikirim. ,3 bulan lalu,1,kipas angin berfungsi dgn baik dan cepat dikirim
1112,1184,Cosmos Setrika Ceramic Sole Plate CI-3150 C,5,"setrikanya memang tipe yang berat gitu.  proses cepat & pengiriman standard,  packingnya aman. ",3 bulan lalu,1,setrikanya memang tipe yang berat gitu proses cepat pengiriman standard packingnya aman
1113,1185,Cosmos FP-300 - Food Processor 300 ml,5,"bagus dan berfungsi tp blm dicoba blend makanan,  semoga pisaunya tajam ya,  thanks",3 bulan lalu,1,bagus dan berfungsi tp blm dicoba blend makanan semoga pisaunya tajam ya thanks
1114,1186,Cosmos CGS-123 P BROWN - Kompor Portable 1.45 Kg 1 Tungku NEW Looks,5,blm dites nyalain,3 bulan lalu,1,blm dites nyalain
1115,1187,Cosmos Setrika Non Stick Soleplate CI-3130 N,5,bagus barangnya. . .  enteng kuga,3 bulan lalu,1,bagus barangnya enteng kuga
1116,1188,Cosmos Setrika Listrik CI-3110 C,5,"barang original,  harga kompetitif n pengiriman cepat",3 bulan lalu,1,barang original harga kompetitif pengiriman cepat
1117,1189,Cosmos Rice Cooker Stainless Steel CRJ-9308 - 2 L,5,"barang original,  harga kompetitif dan pengiriman cepat",3 bulan lalu,1,barang original harga kompetitif dan pengiriman cepat
1118,1190,Cosmos CRJ-3307 - Rice Cooker 1.8 L Fabelia series Tiger,5,keren,3 bulan lalu,1,keren
1119,1191,Cosmos CM-1679 - Hand Mixer,4,"kualitas barang sesuai harga,  not bad lah. . 
semoga awet. ",3 bulan lalu,1,kualitas barang sesuai harga not bad lah semoga awet
1120,1192,Cosmos CB-282 P - Blender 2 L,5,"masyaallah barangnya sesuai selamat sampai tujuan
suka banget🥰",3 bulan lalu,1,masyaallah barangnya sesuai selamat sampai tujuan suka banget
1121,1193,Cosmos 16-WFC - Kipas Angin / Wall Fan 16 inch,5,semoga awet,3 bulan lalu,1,semoga awet
1122,1194,Cosmos CRJ-1031 - Rice Cooker 0.3 L Mama Suka,5,"brg sesuai,  blm dipakai.  mdh2an awet",3 bulan lalu,1,brg sesuai blm dipakai mdhan awet
1123,1195,Cosmos Harmond CRJ-6601 - Rice Cooker 0.8 L (Black/White),5,sesuai pesanan dan cepat sampai. . ,3 bulan lalu,1,sesuai pesanan dan cepat sampai
1124,1197,Cosmos Rice Cooker Harmond CRJ-6028 V - 1.2L,5,"barang bagus,  murah,  respon cepat",3 bulan lalu,1,barang bagus murah respon cepat
1125,1198,Cosmos Setrika Non Stick Soleplate CI-3130 N,5,"material produk bagus kualitas produk bagus produk original ukuran produk sesuai barang sdh sampai dan oke,  fast respon,  seller ramah dan pelayanan sangat memuaskan,  nnti. . .  ",3 bulan lalu,1,material produk bagus kualitas produk bagus produk original ukuran produk sesuai barang sdh sampai dan oke fast respon seller ramah dan pelayanan sangat memuaskan nnti
1126,1199,Cosmos Food Processor FP-323 KUBA NEW PRODUK,5,terima kasih.  belum dibuka.  semoga bekerja waktu mau dipakai. ,3 bulan lalu,1,terima kasih belum dibuka semoga bekerja waktu mau dipakai
1127,1200,Cosmos Harmond CRJ-6123 - Rice Cooker 0.6 L Mama Suka,5,terima kasih. ,3 bulan lalu,1,terima kasih
1128,1201,Cosmos 16-SN - Kipas Angin / Fan 2in1 16 inch (Stand & Desk),5,"thankyou promo nyaaaaa serba 50 ribu di wib,  ayooo gaesss cek toko orange nama moocy. storee banyak barang promo loh dan muraaah muraaah letsgokk",3 bulan lalu,1,thankyou promo nyaaaaa serba ribu di wib ayooo gaesss cek toko orange nama moocy storee banyak barang promo loh dan muraaah muraaah letsgokk
1129,1202,Cosmos Setrika Non Stick Soleplate CI-3120 N,5,"saran aja, ,  ekspedisinya di ganti untuk yg gratis ongkir,  karena anter aja mah kadang lama banget. 

untuk barang alhamdulillah oke,  muda mudahan awet",3 bulan lalu,1,saran aja ekspedisinya di ganti untuk yg gratis ongkir karena anter aja mah kadang lama banget untuk barang alhamdulillah oke muda mudahan awet
1130,1203,Cosmos 12 DSE - Kipas Angin Meja 12 inch,5,"awet,  udah beberapa bulan masih kencang",3 bulan lalu,1,awet udah beberapa bulan masih kencang
1131,1204,Cosmos CRJ-3126 - Rice Cooker 1.8 L (Low Watt),5,nasi matang merata 👍 mutu terjamin sni garansi terjamin ringan tapi kokoh gampang dibersihkan proses pesanan cepat packaging aman 🙏 packaging rapi nasinya tahan lama 🍚. . .  ,3 bulan lalu,1,nasi matang merata mutu terjamin sni garansi terjamin ringan tapi kokoh gampang dibersihkan proses pesanan cepat packaging aman packaging rapi nasinya tahan lama
1132,1205,Cosmos CRJ-1001 N - Rice Cooker 0.6 L,5,barang ori dan bagus,3 bulan lalu,1,barang ori dan bagus
1133,1206,Cosmos CRJ-3232 - Rice Cooker 1.8 L,5,"barang sedikit cacat bagian depan, gompal",3 bulan lalu,1,barang sedikit cacat bagian depan gompal
1134,1207,Cosmos CIS-318 F1 - Setrika Listrik,5,"barang original,  berfungsi semuanya,  garansi resmi,  packaging aman",3 bulan lalu,1,barang original berfungsi semuanya garansi resmi packaging aman
1135,1208,Cosmos 12-BFE ONY - Box Fan 12 inch with Mosquito Repellent,5,pengiriman lebih cepat dari perkiraan. . ,3 bulan lalu,1,pengiriman lebih cepat dari perkiraan
1136,1209,Cosmos Food Processor FP-323 KUBA NEW PRODUK,5,"baru di bongkar,  belom dicoba. .  mudah2an awet",3 bulan lalu,1,baru di bongkar belom dicoba mudahan awet
1137,1210,Cosmos CB-282 G - Blender 2 L,3,mohon diperhatikan lagi qcnya karna barang datang kabel power putus,3 bulan lalu,1,mohon diperhatikan lagi qcnya karna barang datang kabel power putus
1138,1211,Cosmos 12 DSE - Kipas Angin Meja 12 inch,5,"packing aman,  barangnya lengkap sesuai deskripsi dan tidak ada kerusakan👍🏻",3 bulan lalu,1,packing aman barangnya lengkap sesuai deskripsi dan tidak ada kerusakan
1139,1212,Cosmos 16-WFG - Wall Fan - 16 Inch,1,"pengiriman lama bgt ,  padahal pilih instan tapi seperti same day .  slow respon juga .  👎",3 bulan lalu,1,pengiriman lama bgt padahal pilih instan tapi seperti same day slow respon juga
1140,1213,Cosmos NEW AIR FRYER CAF-6603,5,"barang bagus,  lumayan murah dan di box terdapat tulisan ""untuk pasangan baru"".  cocok banget buat hadiah pernikahan pengantin baru!",3 bulan lalu,1,barang bagus lumayan murah dan di box terdapat tulisan untuk pasangan baru cocok banget buat hadiah pernikahan pengantin baru
1141,1214,Cosmos CGC-121 P N - Kompor Gas Portable 0.95 Kg 1 Tungku NEW,5,kompor nya lucu bangett,3 bulan lalu,1,kompor nya lucu bangett
1142,1215,Cosmos CB-282 G Jelly star,5,pisaunya tajam 👍 gampang dibersihkan garansi terjamin nggak cepat berbau ringan tapi kokoh gampang dipakai penjualnya ramah banget proses pesanan cepat packaging aman 🙏. . .  ,3 bulan lalu,1,pisaunya tajam gampang dibersihkan garansi terjamin nggak cepat berbau ringan tapi kokoh gampang dipakai penjualnya ramah banget proses pesanan cepat packaging aman
1143,1216,Cosmos 9-LDA TWINO - Kipas Angin 2in1 - 9 inch (Desk & Wall),5,"anginnya kenceng, ok",3 bulan lalu,1,anginnya kenceng ok
1144,1217,Cosmos Food Processor FP-323 KUBA NEW PRODUK,5,"bagus banget,  untuk harga segini sangat worth it!",3 bulan lalu,1,bagus banget untuk harga segini sangat worth it
1145,1218,Cosmos CRJ-8229 WBS - Rice Cooker 2 L (Tongolan Super),5,"pengiriman cepat,  paking rapih dan penjual ramah. ",3 bulan lalu,1,pengiriman cepat paking rapih dan penjual ramah
1146,1219,Cosmos Setrika Non Stick Soleplate CI-4110 N,5,barang aman bagus dan packingan aman rekomended cepet panas,3 bulan lalu,1,barang aman bagus dan packingan aman rekomended cepet panas
1147,1220,Cosmos Harmond CRJ-6123 - Rice Cooker 0.6 L Mama Suka,5,mutu terjamin sni garansi terjamin penjualnya ramah banget packaging aman 🙏 proses pesanan cepat packaging rapi respon penjualnya top gampang dibersihkan ringan tapi kok. . .  ,4 bulan lalu,1,mutu terjamin sni garansi terjamin penjualnya ramah banget packaging aman proses pesanan cepat packaging rapi respon penjualnya top gampang dibersihkan ringan tapi kok
1148,1221,Cosmos Standing  Fan 16 SAE  ( 16 INCH),5,bagus,4 bulan lalu,1,bagus
1149,1222,Cosmos CRJ-3307 GMBORI,5,nasi matang merata 👍 nasinya tahan lama 🍚 ringan tapi kokoh garansi terjamin proses pesanan cepat packaging aman 🙏 gampang dibersihkan packaging rapi mutu terjamin sni,4 bulan lalu,1,nasi matang merata nasinya tahan lama ringan tapi kokoh garansi terjamin proses pesanan cepat packaging aman gampang dibersihkan packaging rapi mutu terjamin sni
1150,1223,Cosmos ELECTRIC FAN WIF-1803 S,5,"double bearing jadi suaranya halus banget,  angin menyebar rata dan body kelihatannya kokoh terimakasih",4 bulan lalu,1,double bearing jadi suaranya halus banget angin menyebar rata dan body kelihatannya kokoh terimakasih
1151,1224,Cosmos ELECTRIC FAN WIF-1803 PS,4,"ada 1 baut yang aus,  namun secara keseluruhan sesuai ekspetasi",4 bulan lalu,1,ada baut yang aus namun secara keseluruhan sesuai ekspetasi
1152,1225,Cosmos CB-282 G Jelly star,5,"paket aman,  performa mantapp",4 bulan lalu,1,paket aman performa mantapp
1153,1226,Cosmos CB-281 G - Blender 2 L,1,"pengiriman lama,  saya pesan pengiriman instant tapi tdk dikirim di hari yg sama,  besoknya harus nyinyir follow up dan dikirim sore nya.  kalau mau beli dengan pengiriman i. . .  ",4 bulan lalu,1,pengiriman lama saya pesan pengiriman instant tapi tdk dikirim di hari yg sama besoknya harus nyinyir follow up dan dikirim sore nya kalau mau beli dengan pengiriman
1154,1227,Cosmos 16-XDC - Kipas Angin / Stand Fan 16 inch,5,packing rapih sukses selalu,4 bulan lalu,1,packing rapih sukses selalu
1155,1228,Cosmos 12-DAR N ONY - Kipas Angin Meja 12 inch,5,"barangnya ori,  packingnya rapi teratur,  barang sesuai pesanan,  pemasangan kipas cukup mudah.  terima kasih cosmos 😊😁👍",4 bulan lalu,1,barangnya ori packingnya rapi teratur barang sesuai pesanan pemasangan kipas cukup mudah terima kasih cosmos
1156,1229,Cosmos 16-SN ONY - Kipas Angin / Fan 2in1 16 inch (Stand & Desk),5,"barang sesuai,  ori. . . packingan rapi. . . tapi sayang pegirimannya nyasar2 lama. . . 2 minggu baru sampe. . . dah lah gitu aja. . . ",4 bulan lalu,1,barang sesuai ori packingan rapi tapi sayang pegirimannya nyasar lama minggu baru sampe dah lah gitu aja
1157,1230,Cosmos CGS-123 P BROWN - Kompor Portable 1.45 Kg 1 Tungku NEW Looks,5,puasss. .  barang mantap. . api bagus. . simple. . aman. . cepat sampai pakai grab fast,4 bulan lalu,1,puasss barang mantap api bagus simple aman cepat sampai pakai grab fast
1158,1231,COSMOS RICE COOKER  NON STICK CRJ 3012 B candy series ,5,"terima kasih, sesuai gambar suka banget sm warnanya
terima kasid",4 bulan lalu,1,terima kasih sesuai gambar suka banget sm warnanya terima kasid
1159,1232,"Cosmos WADESTA 16-S033 ONY - Kipas Angin 3in1-16 inch Wall,Desk,Stand",5,"barangnya dikemas rapi,  alasnya kokoh dan lumayan berat,  instalasinya mudah,  berfungsi dengan baik,  semoga awet ☺👍",4 bulan lalu,1,barangnya dikemas rapi alasnya kokoh dan lumayan berat instalasinya mudah berfungsi dengan baik semoga awet
1160,1233,Cosmos Blenz CB-802 - Blender 1.2 L,5,"pengiriman cepat,  barang sudag digunakan dan baik",4 bulan lalu,1,pengiriman cepat barang sudag digunakan dan baik
1161,1234,Cosmos Marble CFP-18 MB F - Non Stick Frypan 18 cm,4,lama dikirim,4 bulan lalu,1,lama dikirim
1162,1235,Cosmos CB-282 G Jelly star,5,pisaunya tajam 👍 nggak cepat berbau packaging aman 🙏,4 bulan lalu,1,pisaunya tajam nggak cepat berbau packaging aman
1163,1236,Cosmos CRJ-101 N - Rice Cooker 0.6 L,5,semoga barangnya awet dan tahan lama ya,4 bulan lalu,1,semoga barangnya awet dan tahan lama ya
1164,1237,Cosmos Blender CB-502 APC jelly star,5,"respon admin memuaskan,  pengiriman juga ok,  barang sampai juga dengan selamat,  produk juga top markotop",4 bulan lalu,1,respon admin memuaskan pengiriman juga ok barang sampai juga dengan selamat produk juga top markotop
1165,1238,Cosmos 16-SN - Kipas Angin / Fan 2in1 16 inch (Stand & Desk),5,bagus dan kokoh,4 bulan lalu,1,bagus dan kokoh
1166,1239,Cosmos On The Go CB-522 - Personal Blender,5,"kereeeen,  bekerja dengan baik",4 bulan lalu,1,kereeeen bekerja dengan baik
1167,1240,Cosmos ELECTRIC FAN WIF-1803 PSR,5,"packaging rapi & aman
barangnya bekerja dengan baik produk sesuai deskripsi kualitas produk bagus",4 bulan lalu,1,packaging rapi aman barangnya bekerja dengan baik produk sesuai deskripsi kualitas produk bagus
1168,1241,Cosmos 9-LDA TWINO - Kipas Angin 2in1 - 9 inch (Desk & Wall),5,barang sudah diterima dgn baik,4 bulan lalu,1,barang sudah diterima dgn baik
1169,1242,Cosmos FP-300 - Food Processor 300 ml,4,proses dan pengiriman barang lama banget,4 bulan lalu,1,proses dan pengiriman barang lama banget
1170,1243,Cosmos 16-XDC - Kipas Angin / Stand Fan 16 inch,5,"bergaransi,  pengiriman barang full bubble wrap,  murah dan ringan.  saat saya coba pertama kali anginnya kencang.  kekurangannya hanya pengatur kecepatan yang harus diputar. . .  ",4 bulan lalu,1,bergaransi pengiriman barang full bubble wrap murah dan ringan saat saya coba pertama kali anginnya kencang kekurangannya hanya pengatur kecepatan yang harus diputar
1171,1244,Cosmos Setrika Non Stick Soleplate CI-3120 N,5,setrika cepat panas,4 bulan lalu,1,setrika cepat panas
1172,1245,Cosmos CRJ-101 N - Rice Cooker 0.6 L,3,"didalam atas rice cookernya udh beda dengan yg lama gada tutup yg bisa dicopot untuk dicuci jadinya atasan rice cooker cepat berkeringat dan nasi jadi cepat kering. 

kala. . .  ",4 bulan lalu,1,didalam atas rice cookernya udh beda dengan yg lama gada tutup yg bisa dicopot untuk dicuci jadinya atasan rice cooker cepat berkeringat dan nasi jadi cepat kering kala
1173,1246,Cosmos CIS-418 - Setrika Listrik,3,"1.  pengiriman lama
2.  kualitas barang sedikiit bermasalah.  setrika dalam kondisi biasa saat dinyalakan lampu penunjuk untuk nilon tidak menyala.  menyala saat di sutera.  i. . .  ",4 bulan lalu,1,pengiriman lama kualitas barang sedikiit bermasalah setrika dalam kondisi biasa saat dinyalakan lampu penunjuk untuk nilon tidak menyala menyala saat di sutera
1174,1247,Cosmos CB-282 P - Blender 2 L,4,"kurir anter aja sangat lambat,  tidak rekomen",4 bulan lalu,1,kurir anter aja sangat lambat tidak rekomen
1175,1248,Cosmos 16-SN - Kipas Angin / Fan 2in1 16 inch (Stand & Desk),5,terimakasih,4 bulan lalu,1,terimakasih
1176,1249,Cosmos CB-282 P - Blender 2 L,5,"fast respon,  packing rapi.  barang sesuai gambar. ",4 bulan lalu,1,fast respon packing rapi barang sesuai gambar
1177,1250,Cosmos 16-SN - Kipas Angin / Fan 2in1 16 inch (Stand & Desk),5,mantap,4 bulan lalu,1,mantap
1178,1251,Cosmos TIF-2001 s - Kipas Angin / Stand Fan 20 Inch,5,barang sesuai pesanan.  packing aman.  isi lengkap.  makasih ya,4 bulan lalu,1,barang sesuai pesanan packing aman isi lengkap makasih ya
1179,1252,Cosmos Blenz CB-832PC - Blender 2 L,5,"blum di coba sih,  tapi  garansi terjamin packaging aman 🙏 packaging rapi respon penjualnya top.  semoga berfungsi baik & awet",4 bulan lalu,1,blum di coba sih tapi garansi terjamin packaging aman packaging rapi respon penjualnya top semoga berfungsi baik awet
1180,1253,Wall Fan Cosmos WBF1804,5,brg sdh smpi,4 bulan lalu,1,brg sdh smpi
1181,1254,Cosmos Harmond CRJ-6601 - Rice Cooker 0.8 L (Black/White),3,"pengiriman oke,  cuman waktu itu pas dateng tutupnya gabisa nutup rapet. .  terus dibawa ke customer service ternyata proses claimnya ribet juga.  jadi gak kepake deh barangn. . .  ",4 bulan lalu,1,pengiriman oke cuman waktu itu pas dateng tutupnya gabisa nutup rapet terus dibawa ke customer service ternyata proses claimnya ribet juga jadi gak kepake deh barangn
1182,1255,Cosmos 16-SN - Kipas Angin / Fan 2in1 16 inch (Stand & Desk),5,"aman,  berfungsi dengan baik 👍",4 bulan lalu,1,aman berfungsi dengan baik
1183,1256,Cosmos ELECTRIC FAN WIF-1803 PS,5,"barang oke,  kokoh,  packaging rapi & aman produk sesuai deskripsi kualitas produk bagus.  cuma role pengiriman tidak terdeteksi,  jadi was2 barang dikirim atau tidak. ",4 bulan lalu,1,barang oke kokoh packaging rapi aman produk sesuai deskripsi kualitas produk bagus cuma role pengiriman tidak terdeteksi jadi was barang dikirim atau tidak
1184,1257,Cosmos Setrika Non Stick Soleplate CI-3130 N,5,"barang ok,  mudah2an awet dipakai",4 bulan lalu,1,barang ok mudahan awet dipakai
1185,1258,Cosmos CRJ-1031 - Rice Cooker 0.3 L Mama Suka,5,"barangnya ok,  mudah2an awet dipakai",4 bulan lalu,1,barangnya ok mudahan awet dipakai
1186,1259,Cosmos CGC-121 P N - Kompor Gas Portable 0.95 Kg 1 Tungku NEW,5,barang sesuai. packaging aman. recomanded,4 bulan lalu,1,barang sesuai packaging aman recomanded
1187,1260,Cosmos 16-SN - Kipas Angin / Fan 2in1 16 inch (Stand & Desk),5,pengiriman cepat produk berfungsi dengan baik,4 bulan lalu,1,pengiriman cepat produk berfungsi dengan baik
1188,1261,Cosmos 16-SN - Kipas Angin / Fan 2in1 16 inch (Stand & Desk),5,pengiriman cepat produk sesuai dan berfungsi dengan baik,4 bulan lalu,1,pengiriman cepat produk sesuai dan berfungsi dengan baik
1189,1262,COSMOS RICE COOKER  NON STICK CRJ 3012 O candy series ,5,"nasi matang merata,  gampang di cucinya krn ga lrngket",4 bulan lalu,1,nasi matang merata gampang di cucinya krn ga lrngket
1190,1263,Cosmos CB-282 P - Blender 2 L,5,"barang bagus,  dan rekomended tokonya",4 bulan lalu,1,barang bagus dan rekomended tokonya
1191,1264,Cosmos Harmond CRJ-6023 N MAMASUKA,5,keren abis. . .  terimakasih,4 bulan lalu,1,keren abis terimakasih
1192,1265,Cosmos 12-DAR N ONY - Kipas Angin Meja 12 inch,5,barang sesuai poko ny bagus,4 bulan lalu,1,barang sesuai poko ny bagus
1193,1266,Cosmos CB-282 P - Blender 2 L,5,barang bagus normal semua namun tutupnya tidak sesuai permintaan yng dikirimkan berbeda minta tutup gelas warna biru dikirim putih,4 bulan lalu,1,barang bagus normal semua namun tutupnya tidak sesuai permintaan yng dikirimkan berbeda minta tutup gelas warna biru dikirim putih
1194,1267,Cosmos 16-XDC - Kipas Angin / Stand Fan 16 inch,5,"barang bagus dan original.  kokoh,  anginnya adem",4 bulan lalu,1,barang bagus dan original kokoh anginnya adem
1195,1268,Cosmos FP-313 - Food Processor 1.2 L,5,mantap berfungsi,4 bulan lalu,1,mantap berfungsi
1196,1269,Kipas Angin 12-PDB Electric Fan Twino (Meja dan Dinding),2,"maaf mau info terkait pengiriman harusnya tanggal 24 sept tiba sesuai estimasi pengiriman,  tapi barang sampai di tanggal 25 sept. 

untuk kelengkapan barang ada item yang. . .  ",4 bulan lalu,1,maaf mau info terkait pengiriman harusnya tanggal sept tiba sesuai estimasi pengiriman tapi barang sampai di tanggal sept untuk kelengkapan barang ada item yang
1197,1270,WADESTA BESI SIF-1804 S,5,rekomended,4 bulan lalu,1,rekomended
1198,1271,Cosmos 16-XDC - Kipas Angin / Stand Fan 16 inch,5,sesuai deskripsi,4 bulan lalu,1,sesuai deskripsi
1199,1273,Cosmos NEW AIR FRYER CAF-6603,5,"pengiriman sesuai estimasi
barang sesuai deskripsi",4 bulan lalu,1,pengiriman sesuai estimasi barang sesuai deskripsi
1200,1274,Cosmos Food Processor FP-323 KUBA NEW PRODUK,5,pengiriman cepat.  bagus barangnya,4 bulan lalu,1,pengiriman cepat bagus barangnya
1201,1275,Cosmos CRJ-1031 - Rice Cooker 0.3 L Mama Suka,5,"barang sesuai dan packing rapih .  semoga awet ,  terimakasih",4 bulan lalu,1,barang sesuai dan packing rapih semoga awet terimakasih
