Nama Pengguna,Produk,Rating,Ulasan,Tanggal
h***O,POLYTRON Mesin Cuci 2 Tabung Giant Series Hijab 8 KG PWM 8076,bintang 5,mantap,Hari ini
hapid,"POLYTRON SMART DIGITAL TV 32""  PLD 32CV1869",bintang 5,"barang original, penerimaan lumbayan cepat.",Hari ini
a***l,POLYTRON Kulkas 1 Pintu Belleza 180 Liter PRA 18J,bintang 5,"very good respond, normal delivery, good quality",Hari ini
T***a,POLYTRON Professional Active Speaker PAS PRO12F6,bintang 5,"barang OK, sistem pengirimannya yg perlu di perhatikan",Hari ini
A***a,POLYTRON Bluetooth Speaker PMA 9321 /B,bintang 5,sudah sampai dan packing aman dan cepat . ongkir nya juga gratis. mantap 👍👍👍👍,Hari ini
d***e,PSR ADL11 SMART REMOTE CONTROL,bintang 1,"Kurir hanya ada pilihan kurir toko, tetapi ternyata memakai jasa KGX.
Tgl 6 pagi order, tgl 7 status sudah diproses dan dikirim (diserahkan ke kurir KGX).
Perlu upaya kom... ",Hari ini
h***h,POLYTRON Mesin Cuci 1 Tabung Zeromatic Laguna Hijab 8 KG PAW 8028,bintang 5,barang sesuai spesifikasi yg di pesan dan pengiriman cepat😉 bismillah awet barang nya,1 hari lalu
Ririn,POLYTRON Smart Cinemax Soundbar LED TV 43 inch PLD 43BAG9953,bintang 5,"beliin ini buat ortu semoga makin heppy dan awet.mesti ada kendala status pengiriman blm di update"" sudah 4 hari 😎 selebih nya mantappp",1 hari lalu
C***k,POLYTRON Smart Cinemax Soundbar TV 32 inch PLD 32BAG9858,bintang 5,enjoy aman,1 hari lalu
Adam,POLYTRON Mesin Cuci 1 Tabung 8 KG PAW 8029Y,bintang 1,"belum genap 1 tahun mesin cuci sudah eror. 
laporan ke service centre tidak kunjung datang teknisinya. no laporan saya CASE/SKM/24/02/08/000005 by the way.",1 hari lalu
Denny,POLYTRON Smart Cinemax Android TV 32 inch PLD 32TAG9855,bintang 5,"barang bagus, garansi mantap 5 tahun",1 hari lalu
I,"POLYTRON Cinemax Soundbar DIGITAL LED TV 32"" PLD 32BV1558",bintang 5,"Paket sudah saya Terima dalam kondisi baik dan sudah dicoba... semuanya normal. 
semoga awet.",1 hari lalu
Aji,POLYTRON Rice Cooker Donabe 2 Liter PRC 1201,bintang 5,"Barang berfungsi dengan baik.
Stelah datang, barang dibuat masak nasi berfungsi normal dengan hasil nasi yang baik ( tergantung beras ).

Karena sebelumnya pernah beli di... ",1 hari lalu
Irawan,POLYTRON Bluetooth Speaker PMA 9321 /B,bintang 5,"Pengiriman cepat. Speaker berfungsi normal. Suara bagus, ada pengaturan bass dan trebel. Bisa pakai kabel aux dan rca. Semoga awet.",1 hari lalu
s***o,POLYTRON Multimedia Speaker PMA 9527 /BA,bintang 5,"kurir ok, seller ok, barang ok. Terima kasih.",1 hari lalu
SUTANDAR,"POLYTRON SMART DIGITAL TV 32""  PLD 32CV1869",bintang 5,terima kasih ya,2 hari lalu
Tharie,POLYTRON Bluetooth Speaker PMA 9310 /BG,bintang 1,order tgl 4 feb dikirim tgl 16 feb itu pun karna tgl 16 saya ajukan komplain ke tokped.. bener² memalukan 👎👎👎👎👎 cukup sekali ini aj belanja dsini,2 hari lalu
C***a,POLYTRON Mesin Cuci 2 Tabung Giant Series Hijab 8 KG PWM 8076,bintang 5,cakep,2 hari lalu
g***a,Polytron AC SMART Neuva Pro SMART AC 1/2 PK PAC 05VZS,bintang 5,"Udah dipake hampir 3 bulan, oke super dingin buat kamar ukuran 3.25 x 3m..kadang buka kamar biar dinginnya smpe ke ruang tamu haha",2 hari lalu
F***d,POLYTRON Smart Projector - PLP 91LFA 120 Inch FHD,bintang 5,masalah cuman di pengiriman barang aman,2 hari lalu
D***r,POLYTRON Mesin Cuci 2 Tabung Giant Series Hijab 8 KG PWM 8076,bintang 1,"slow respon
membatalkan secara sepihak
semoga kena suspend dr Tokopedia",2 hari lalu
agus,POLYTRON Bluetooth Speaker PMA 9321 /B,bintang 5,"sangat puas ,,, barang sesuai budged",2 hari lalu
Imam,POLYTRON Mesin Cuci Front Loading 100% Kering Inverter 11 KG PFL 1105,bintang 5,"Mantappp. Cucian bener2 kering. Yg ngirim kurir dari polytron langsung. Tapi sayangnya lama sampe seminggu.

Petunjuk pemasangan cukup jelas.",2 hari lalu
andi,POLYTRON Active Speaker PAS 8FF22,bintang 5,mantap barang normal,3 hari lalu
w***u,POLYTRON Mesin Cuci 2 Tabung Primadona Samba 8 Kg PWM 8072,bintang 5,barang original. pengiraman cepat. kurir ramah. kerdus diterima kondisi baik,3 hari lalu
Sastra,POLYTRON Active Speaker PAS 10D28,bintang 5,Beli Speaker Aktif ya yg jelas jelas aja lah... Polytron the winning theme...,3 hari lalu
I***n,Polytron Speaker PPB C05A6,bintang 5,Suaranya mantap 🔊 Desain elegan Bahannya kokoh Respon penjualnya top,3 hari lalu
Muhammad,POLYTRON Smart Cinemax Soundbar TV 32 inch PLD 32BAG9858,bintang 5,produk lokal mantap,3 hari lalu
Gilang,POLYTRON Mesin Cuci 2 Tabung Primadona Giant 9 Kg PWM 9072,bintang 5,Bisa muat banyak Barangnya original 👍 Gampang dipakai Hemat listrik ⚡ Desainnya elegan ✨ Packaging aman 🙏,3 hari lalu
Azhar,POLYTRON Mesin Cuci Front Loading 100% Kering Inverter 11 KG PFL 1105,bintang 5,"barang telah sampai, pelayanan cepat dan barang nya aman.",4 hari lalu
Azhar,POLYTRON 4K UHD Smart Cinemax Soundbar Google TV 43 Inch PLD 43BUG5959,bintang 5,"barang telah sampai, pelayanan cepat dan barang nya aman.",4 hari lalu
Bima,POLYTRON Kulkas 1 Pintu Belleza Varia 150 liter PRA 15DRX,bintang 4,"barang dikirim tepat waktu, admin responsif. ada barang yang cacat tapi urusan gampang melalui CS nyaa. terimakasih",4 hari lalu
Rama,POLYTRON Mesin Cuci 1 Tabung Zeromatic series Hijab 7.5 KG PAW 7527,bintang 5,alhamdulillah sudah datang keren banget pokonya terimakasih seller and kurir,4 hari lalu
Rahmatika,POLYTRON Mesin Cuci 1 Tabung Zeromatic Hijab 7.5 KG PAW 75517,bintang 1,Cukup sekali sih beli disini. Beli tanggal 1 Feb baru sampe tanggal 14 Feb. 2 minggu ga ada kabar sama sekali. Admin nya semuanya gak informatif sama sekali. Harus selalu... ,4 hari lalu
A***h,POLYTRON Kulkas 1 Pintu Belleza 170 liter PRA 17Z,bintang 3,Sebenarnya produknya bagus tapi ada dua catatan tidak baik: 1. Ada sedikit penyok di bagian dalam pintu yang berwarna putih 2. Pintu kulkas datang dalam keadaan tidak dip... ,4 hari lalu
Mentari,"POLYTRON SMART DIGITAL TV 24""  PLD 24CV1869",bintang 1,"Pembelian kedua.... INI TV PENANGKAP SINYALNYA JELEK BANGET, dirumah ada TV 5 dicobain tetep aja SINYAL ILANG2AN....Coba perbaikin bagian produksi...Saya beli dua TV ini... ",4 hari lalu
Mentari,"POLYTRON SMART DIGITAL TV 24""  PLD 24CV1869",bintang 1,"Pembelian Pertama.... INI TV PENANGKAP SINYALNYA JELEK BANGET, dirumah ada TV 5 dicobain tetep aja SINYAL ILANG2AN....Coba perbaikin bagian produksi...Saya beli dua TV in... ",4 hari lalu
Eka,POLYTRON Chest Freezer 100 Liter PCF 118,bintang 5,"Barang sesuai deskripsi, tidak cacat saat pengiriman, dites menyala suhunya bisa dingin",4 hari lalu
R***n,POLYTRON Rice Cooker Donabe 2 Liter PRC 1201,bintang 5,aesthetic,4 hari lalu
Lukman,"POLYTRON Cinemax Soundbar DIGITAL LED TV 32"" PLD 32BV1558",bintang 5,barang sudah nyampai sangat cepat.Toko ini sangat recommended dan sangat ramah.Pelayanan super cepat dan barang super aman dan origonal.Sukses selalu seller dan kurir,4 hari lalu
G***r,POLYTRON Kulkas 2 Pintu Beauty metal door 210 liter PRB 219,bintang 3,"banyak kendala nya ketika memesan, banyak drama, dan pengiriman lama juga",4 hari lalu
Ripa,POLYTRON Kulkas 1 Pintu Beauty metal door 170 liter PRB 179,bintang 5,Alhamdulillah barangnya sangat bagus🥰,5 hari lalu
Uhendrayana,"POLYTRON Cinemax Digital LED TV 32"" PLD 32TV1855",bintang 5,"stock habis pengiriman lamaaaa,,",5 hari lalu
Noor,"POLYTRON SMART DIGITAL TV 24""  PLD 24CV1869",bintang 5,"berfungsi bgt baik Alhamdulillah selamat sampai tujuan hanya pengiriman yang lama .
kk untuk klaim gratis langganan mola aksesnya gimana ?",5 hari lalu
Septi,POLYTRON Mesin Cuci 1 Tabung Zeromatic series Hijab 8.5 KG PAW 8527,bintang 5,"Barang sesuai pesanan, original, pengiriman cepat, respon penjual baik...",5 hari lalu
Abdul,POLYTRON Mesin Cuci 2 Tabung Giant Series Hijab 8 KG PWM 8076,bintang 5,top markotop,6 hari lalu
J***i,POLYTRON Mesin Cuci 2 Tabung Giant Series Hijab 7 KG PWM 7076,bintang 5,"Alhamdulillah barang sudah sampai dengan selamat, admin ramah, kurirnya juga ramah. Cuman pengiriman agak lama karna libur panjang.
Overall baguuuss semuanyaa, terima kas... ",6 hari lalu
Suharyanto,POLYTRON Mesin Cuci 1 Tabung Zeromatic Laguna Hijab 10 KG PAW 1028,bintang 5,"mantap barang original, sesuai diskripsi.sangat membantu kegiatan istri, semua jadi ringan. semoga awet",6 hari lalu
Ria,POLYTRON Bluetooth Speaker PMA 9526 /B,bintang 3,"utk pengiriman baiknya disertakan nomor resi, dan diupdate di tokopedia sehingga customer bs melihat progress pengiriman sampai dimana. jangan bilangnya sudah masuk pengi... ",6 hari lalu
R***d,POLYTRON Mesin Cuci 1 Tabung Zeromatic Laguna Hijab 8 KG PAW 8028,bintang 4,Barqng bagus hanya pengiriman lama perlu ditingkatkan pelayqnan.terima kasih,6 hari lalu
Hary,POLYTRON Kulkas 2 Pintu Belleza 210 liter PRM 21DMY,bintang 5,barang sampai dengan aman,6 hari lalu
S***h,POLYTRON Kulkas 2 Pintu Belleza JUMBO Inverter 240 Liter PRW 25VX,bintang 5,"Sejauh ini barang bagus, sudah 5bln pemakaian",6 hari lalu
D***y,POLYTRON Mesin Cuci 1 Tabung Zeromatic Hijab 7.5 KG PAW 75517,bintang 5,Sudah di terima dengan baik.,1 minggu lalu
Muhamad,POLYTRON Cinemax Digital TV 24 inch PLD 24TV1855,bintang 5,bagus juga TV nya dan suara soundbar nya juga mantap,1 minggu lalu
Rahadian,Polytron AC SMART Neuva Pro SMART AC 1/2 PK PAC 05VZS,bintang 5,pengiriman tepat waktu.. barang original karena official,1 minggu lalu
Faradita,POLYTRON Kulkas 2 Pintu Beauty Steel 240 liter PRB 287LB,bintang 5,"Bisa muat banyak Mutu terjamin SNI Barangnya original 👍 Ada garansi resmi Desainnya elegan ✨ Gampang dipakai Proses pesanan cepat Packaging aman 🙏
cek out 2 februari, p... ",1 minggu lalu
Muhammad,POLYTRON Professional Active Speaker PAS PRO12F6,bintang 5,"maaf br kasih ulasan skrg
kualitas bagus",1 minggu lalu
Budi,POLYTRON Smart Projector - PLP 91LFA 120 Inch FHD,bintang 3,"CS ditanya delivery, jawab normatip seperti robot, spt tidak ada kepastian..
delivery leleeet  info 2 -7 hari tp delay 8 hari total 15 hari dari pembelian, padahal barang... ",1 minggu lalu
N***S,"POLYTRON SMART DIGITAL TV 24""  PLD 24CV1869",bintang 5,"terimakasih topet
semoga awet",1 minggu lalu
InitialF,POLYTRON New Belleza Big Liter Kulkas 2 Pintu PRM 495X,bintang 5,"barang yang datang, sesuai dengan barang yang dipesan, ga ada cacat, datang mulus",1 minggu lalu
narman,POLYTRON Mesin Cuci 1 Tabung Zeromatic Hijab 9 KG PAW 90518B,bintang 5,mantaaaaaps sesuai ekspektasi,1 minggu lalu
N***r,POLYTRON Kulkas 2 Pintu Beauty metal door 210 liter PRB 219,bintang 5,"barang sudah sampai, thx seller + tokped",1 minggu lalu
Gede,POLYTRON Mesin Cuci 1 Tabung 8 KG PAW 8029Y,bintang 5,"barang oke, sampai cepat cuma 4 hari walaupun lokasi Bali timur. nota lengkap kartu garansi",1 minggu lalu
Ahmad,POLYTRON Cinemax Digital TV 24 inch PLD 24TV1855,bintang 5,barang bagus.. berfungsi dengan baik.. pengirimannya juga cepat,1 minggu lalu
fariz,POLYTRON Mesin Cuci 1 Tabung Zeromatic Hijab 10 KG PAW 10518B,bintang 5,cuma agak lama aja pengirimanya,1 minggu lalu
Linda,POLYTRON Kulkas 2 Pintu Belleza 220 liter PRM 23DMY,bintang 5,"Barang sesuai deskripsi, bagus, harga murah
banyak diskon
pengiriman aman
semoga awet",1 minggu lalu
farras,POLYTRON 4K UHD Smart Cinemax Soundbar Google TV 50 Inch PLD 50BUG5959,bintang 3,pengirimannya prlu ditingkatkan lagi shg pembeli merasa puas,1 minggu lalu
S***r,POLYTRON Kulkas 1 Pintu Metallic 150 Liter PRB 157P,bintang 3,"Penyok sedikit, tapi tidak masalah cuma jadi kurang sempurna aja.",1 minggu lalu
b***g,POLYTRON Cinemax Digital TV 24 inch PLD 24TV1855,bintang 5,cakep barang nya,1 minggu lalu
Ridho,POLYTRON Mesin Cuci 1 Tabung Zeromatic Hijab 9 KG PAW 90518B,bintang 3,"barang datang sudah ada penyokan, bekas d kardusnya pun ada",1 minggu lalu
Abdul,POLYTRON Mesin Cuci 1 Tabung Zeromatic Laguna Hijab 8 KG PAW 8028,bintang 5,mantap punyaaaaa,1 minggu lalu
Abu,"POLYTRON DIGITAL LED TV 32"" PLD 32V1853",bintang 5,Alhamdulillah sudah sampai.,1 minggu lalu
W***A,POLYTRON Bluetooth Speaker PMA 9310 /BG,bintang 5,"barang paket sudah sampai di terima dengan selamat, pengiriman barang paket cepat dan aman melalui cargo, kwalitas barang bagus original suara mantap penampilan Oke Polyt... ",1 minggu lalu
Telly,POLYTRON Primadona Giant Mesin cuci 2 tabung 14 Kg PWM 1403,bintang 4,semoga lancar dan tahan lama,1 minggu lalu
K***o,POLYTRON Active Speaker PAS 8F12,bintang 5,"mantap sesuai pesanan,dan deskripsi ,,pakingnya aman, kualitas original semua berfungsi dengan baik ...maaf ga bisa kasi foto buat loading susah...cukup bintang yg berbic... ",1 minggu lalu
Lili,POLYTRON Kulkas 1 Pintu Beauty Steel 170 liter PRB 177LB,bintang 5,mantap kulkasnya dingin..,1 minggu lalu
Aditya,POLYTRON Kulkas Mini 50 liter PRH 51R,bintang 5,Barang original berfunvsi dengan baik,1 minggu lalu
D***s,POLYTRON Mesin Cuci 1 Tabung Zeromatic Hijab 9 KG PAW 90518B,bintang 5,pengiriman cepat,1 minggu lalu
S***h,POLYTRON Mesin Cuci 1 Tabung Zeromatic Laguna Hijab 10 KG PAW 1028,bintang 1,"baru beli barang gak bisa di pake, udh panggil teknisi bener eh rusak lagi sampe 5x bolak balik panggil teknisi nya buat benerin tp gak lama rusak lagi. parah",1 minggu lalu
Kurniawan,POLYTRON Multimedia Speaker PMA 9310 /BG,bintang 5,Bombastis,1 minggu lalu
Sumardi,POLYTRON Professional Active Speaker PAS PRO12F6,bintang 5,"mantab....
suaranya bagus
semoga awet...polytron memang kebanggaan dalam negeri.",1 minggu lalu
Hendra,Polytron Party Speaker Bluetooth Karaoke Portable Wireless PPS 8L22,bintang 1,"barang baru di kirim di hari ke 7 sejak tanggal pemesanan dan barang di terima di hari ke 8. 
itupun karena di komplain duluan dg melibatkan pihak tokopedia care service.... ",1 minggu lalu
S***a,POLYTRON Mesin Cuci 2 Tabung Giant Series Hijab 9 KG PWM 9076,bintang 5,mantul bosqu semoga awet ya 😁,1 minggu lalu
Ana,POLYTRON Mesin Cuci 1 Tabung Zeromatic series Hijab 8.5 KG PAW 8527,bintang 5,pengiriman cepat dan aman karena pengiriman dari toko sendiri. barang udah pasti ori harga murah. puas banget belanja disini,1 minggu lalu
A***i,POLYTRON Kulkas 1 Pintu Belleza 180 liter PRA 18Z,bintang 5,keren,1 minggu lalu
Solikin,POLYTRON Smart Cinemax Android TV 43 inch PLD 43TAG9959,bintang 5,"Produk diterima dalam kondisi baik, layanan seller baik, semoga produknya awet, recommended seller",1 minggu lalu
samsul,POLYTRON Multimedia Speaker PMA 9527 /BA,bintang 5,"barang sesuai pic tokonya amanah, pengirimanya yg lama",1 minggu lalu
Michelle,POLYTRON Mesin Cuci 2 Tabung Giant Series Hijab 7 KG PWM 7076,bintang 5,"Barang nyampe dengan baik, kurir ok, lengkap, semua terimakasih",1 minggu lalu
Liya,POLYTRON Dispenser Galon Bawah Hydra dengan UV PWC 778UV,bintang 5,gratis ongkir pengiriman cepat... mantappp pokoknya.smg awet,2 minggu lalu
Hendra,POLYTRON Multimedia Speaker PMA 9310 /BG,bintang 5,mantappp,2 minggu lalu
M***l,"POLYTRON DIGITAL LED TV 32"" PLD 32V1853",bintang 5,"barang sesuai deskripsi, packing aman pake kayu",2 minggu lalu
Ricky,Polytron AC SMART Neuva Pro SMART AC 1/2 PK PAC 05VZS,bintang 5,"bagus, aplikasi nyala, Polytron cooperative membantu ...",2 minggu lalu
Abdul,POLYTRON Dispenser Galon Bawah PWC 600,bintang 5,"oke , tapi pengiriman lama H+4 baru sampe padahal tinggal dijakarta selatan",2 minggu lalu
Dedi,POLYTRON Active Speaker PAS 8CF28,bintang 5,"barangnya bagus
suaranya joss
pengiriman cukup cepat",2 minggu lalu
Ardianto,POLYTRON Mesin Cuci 2 Tabung Giant Series Hijab 10 KG PWM 1076,bintang 5,alhamdulillah barang dteng dengan selamat. mesin cuci baru mengganti polytron model lama.mudah2an lebih awet dari yg kmrn.,2 minggu lalu
Adi,POLYTRON Kulkas 1 Pintu Belleza 170 liter PRA 17Z,bintang 5,"Mantap, keren kulkasnya. Tadinya pengen yang PRA 18Z, tapi keburu abis... huhu",2 minggu lalu
Marsiswanto,POLYTRON Belleza JUMBO Inverter Kulkas 2 Pintu 220 Liter PRW 23VX,bintang 5,Keren,2 minggu lalu
Dadan,POLYTRON Active Speaker PAS 8EF22,bintang 5,"Barang sesuai deskripsi,bagus dan berfungsi dgn baik.Harga ekonomis dan ada potongan harga. Pengiriman cepat. Seller ramah. Terimakasih..",2 minggu lalu
S***n,POLYTRON Mesin Cuci 2 tabung 8Kg Primadona Giant PWM 801,bintang 5,Bagus sih. Cuman lama prosesnya. pengirimannya cukup lah yapakai kurir toko soalnya,2 minggu lalu
a***h,POLYTRON Professional Active Speaker PAS PRO15F3,bintang 5,semua berfungsi sbagai mana mestinya,2 minggu lalu
Sri,POLYTRON New Belleza Inverter Kulkas 2 pintu Side by side PRS 460B,bintang 5,"garansi cukup lama
spesifikasi bagus
ukuran cukup luas, kemudahan menggunakan juga sangan mudah, daya listrik low Watt, pengiriman cepet kurir amanah baik, dinkirim pas t... ",2 minggu lalu
DEDE,POLYTRON Multimedia Speaker PMA 9310 /BG,bintang 5,"recommended seller dgn fasilitas ongkir tokonya, 👍👍👍👍👍⭐⭐⭐⭐⭐",2 minggu lalu
sohifuddin,POLYTRON Active Speaker PAS 10DF28,bintang 5,Suaranya mantap 🔊,2 minggu lalu
m***m,Polytron AC Neuva Pro 1 PK PAC 09VZ,bintang 5,sesuai deskripsi,2 minggu lalu
DEKI,POLYTRON Active Speaker PAS 8F12,bintang 5,"barang mulus, ori, sesuai spesifikasi, kualitas suara mantap. tks",2 minggu lalu
Dede,POLYTRON Multimedia Speaker PMA 9526 /B,bintang 5,suara nya bagus . . apalagi bass nya mantep 👍👍👍👍,2 minggu lalu
D***i,"POLYTRON SMART DIGITAL TV 43""  PLD 43CV1569",bintang 4,"dari mulai pemesanan hari jum'at baru di proses hari senin, hari senin juga brg di kirim sampai akhirnya barang datang di hari jum'at berikutnya.. total proses +... ",2 minggu lalu
Samuel,POLYTRON Chest Freezer 200 Liter PCF 218,bintang 3,Barang pertama yang diterima pintu kulkas penyok. Proses penukaran lama sekali pembelian tanggal 5 januari baru di tukar tgl 1 feb udh nyaris sebulan,2 minggu lalu
F***i,POLYTRON 4K UHD Smart Google TV 43 Inch PLD 43UG5959,bintang 4,"Barangnya oke, pengirimannya tapi ya allah.",2 minggu lalu
D***a,POLYTRON Kulkas 1 Pintu Belleza 170 liter PRA 17Z,bintang 5,"Alhamdulillah kulkasnya sampai dengan selamat, tidak ada yg penyok lecet, berfungsi juga dengan baik",2 minggu lalu
S***a,POLYTRON Kulkas 1 Pintu Belleza 180 liter PRA 18DMY,bintang 5,"Proses pengiriman barang cepat
pesan jum'at malam, barang sampai dihari minggu sore
kurir ramah, produk lengkap semua gaada yang kurang
semoga barangnya awet, dari du... ",2 minggu lalu
Nurhidayah,POLYTRON Mesin Cuci 1 Tabung Zeromatic Hijab 7.5 KG PAW 75517,bintang 5,barang bagus banget.packing rapih.puas.puas banget,2 minggu lalu
T***I,POLYTRON Multimedia Speaker PMA 9310 /BG,bintang 5,suara oke.. mantap,2 minggu lalu
Dodi,POLYTRON Multimedia Speaker PMA 9310 /BG,bintang 5,sesuai dengan harga nya,2 minggu lalu
D***r,POLYTRON Kulkas 1 Pintu Belleza 150 liter PRA 15CMS,bintang 5,Awesome!,2 minggu lalu
Hendi,POLYTRON Kulkas 2 Pintu New Belleza Big Liter 350 Liters PRM 495GH,bintang 5,barang ok,2 minggu lalu
B***g,POLYTRON Kulkas 2 Pintu Beauty metal door 210 liter PRB 219,bintang 3,"pengiriman dan kemasan kurang aman..
Kulkas Saya penyok",2 minggu lalu
N***a,POLYTRON Kulkas 1 Pintu Metallic 180 Liter PRB 186,bintang 5,"Mantaap, Sampai dengan Selamat...",2 minggu lalu
Sutikno,POLYTRON Mesin Cuci 1 Tabung 10 KG PAW 1029Y,bintang 5,"barang sesuai diskripsi, kurirnya sabar banget. terima kasih",2 minggu lalu
Yana,Polytron AC Deluxe 2 1 PK PAC 09VH,bintang 5,mantap surantap. pesanan kedu pengiriman nya lebih cepat makasih,2 minggu lalu
I***n,Polytron Speaker PPB C05A6,bintang 5,Respon penjualnya top,2 minggu lalu
ANDREAS,"POLYTRON LED TV DIGITAL 43"" PLD 43V8853",bintang 5,"barang oke n pengiriman cepat, Packaging aman",2 minggu lalu
Muhamad,"POLYTRON Cinemax Digital LED TV 32"" PLD 32TV1855",bintang 5,sipp,2 minggu lalu
Muhamad,POLYTRON Smart Cinemax Android TV 32 inch PLD 32TAG9855,bintang 5,alhamdulillah barang baguss.. sudah diseting udah dipasang juga. moga awet ya.. tp sayang pengiriman lama nunggu sampe ubanan. coba Polytron Official Store kaji ulang mod... ,2 minggu lalu
P***o,POLYTRON Multimedia Speaker PMA 9527 /BA,bintang 5,Suara mantap jos gandos.,2 minggu lalu
lastri,POLYTRON Multimedia Speaker PMA 9310 /BG,bintang 5,ok...normal,2 minggu lalu
Yogie,Polytron PPA FP30 Mixer Amplifier 30 Watt,bintang 5,Barangnya original 👍,2 minggu lalu
Mas,POLYTRON Mesin Cuci 2 Tabung Primadona Giant 9 Kg PWM 9072,bintang 5,Barangnya original 👍 Mutu terjamin SNI Ada garansi resmi Desainnya elegan ✨ Proses pesanan cepat Packaging aman 🙏 Packaging rapi Respon penjualnya top Penjualnya ramah... ,2 minggu lalu
Vinsent,POLYTRON Mesin Cuci 1 Tabung Zeromatic Hijab 9 KG PAW 90518B,bintang 5,barang sudah sampai dan berfungsi dengan baik. thankyou,2 minggu lalu
h***r,POLYTRON Mesin Cuci 2 Tabung Giant Series Hijab 7 KG PWM 7076,bintang 5,"Barang bagus
Pengiriman cepatt",2 minggu lalu
Nikmatulloh,POLYTRON Multimedia Speaker PMA 9310 /BG,bintang 5,"suara mantap, sayang pengirimannya lama pickup 1 mingguan, ppadahal dari tangerang",2 minggu lalu
MUHAMAD,POLYTRON Kulkas 2 Pintu Beauty metal door 210 liter PRB 219,bintang 5,"Alhamdulillah sampai dengan selamat tidak ada yang lecet aman semua...
cuma belum di coba karna buat seserahan nikah hehehe
pengiriman lumayan cepat 3 hari",2 minggu lalu
Prasojo,Polytron Speaker PPB W05A6,bintang 5,"produk original, garansi resmi. berkualitas bagus. pokoknya oke ocelah. jossssss Gampang rakitnya Garansi terjamin",2 minggu lalu
Prasojo,4K android box Memory 3+32 GB Free Mola 12 Bulan Play in 4K UHD PDB F1,bintang 5,"produk original, garansi resmi. berkualitas bagus. pokoknya oke ocelah. jossssss",2 minggu lalu
Prasojo,4K android box Memory 3+32 GB Free Mola 12 Bulan Play in 4K UHD PDB F1,bintang 5,"produk original, garansi resmi. berkualitas bagus. pokoknya oke ocelah. jossssss",2 minggu lalu
iif,POLYTRON Multimedia Speaker PMA 9526 /B,bintang 5,mantap bgt tokonya amanah terimakasih,2 minggu lalu
Erni,POLYTRON Kulkas 1 Pintu Belleza 150 liter PRA 15DMY,bintang 5,Berfungsi dengan baik. Sebelumnya terima barang defect tapi sudah di ganti unit baru ± 12 hari dari kompline. Jangan lupa sertakan bukti dan video unboxing,2 minggu lalu
Bagus,POLYTRON Multimedia Speaker PMA 9310 /BG,bintang 5,suara ga usah dj ragukan lahi,2 minggu lalu
Stephen,POLYTRON HiFi Speaker AUDIVO PHS 6A,bintang 5,very good quality Bluetooth speakers we've mounted them outside and I'm impressed with the quality and the connection.,2 minggu lalu
G***n,POLYTRON Bluetooth Speaker PMA 9321 /B,bintang 5,"berfungsi dengan baik,semoga awet...
Thx Polytron",2 minggu lalu
Anshori,"POLYTRON Cinemax Digital LED TV 32"" PLD 32TV1855",bintang 5,overall okelah,2 minggu lalu
Rohman,"POLYTRON SMART DIGITAL TV 32""  PLD 32CV1869",bintang 5,"Barang cepat sampai,. semoga awet",2 minggu lalu
C***A,POLYTRON New Belleza Inverter Kulkas 2 pintu Side by side PRS 460B,bintang 5,Product sesuai deskripsi dan kualitas rasa dijamin manstabs!! TOP BGT dah!!! Pengiriman Instant sesuai Service yang saya pilih!!! Thank you Good Seller!,2 minggu lalu
Hasan,POLYTRON Active Speaker PAS 8F12,bintang 5,"secara kualitas barang bagus, bass nya dapet buat karaoke mantab juga, cuma mwmang pengiriman agak nunggu aja",2 minggu lalu
Ali,POLYTRON Active Speaker PAS 8SCA22 /-FM,bintang 5,"datang dengan selamat tanpa cacat ..
pengiriman juga cepat sampai",2 minggu lalu
Prasetyo,POLYTRON Bluetooth Speaker PMA 9525 /W,bintang 5,"barang original mantap sekali..... bassnya bikin bangunkan semangat.... buat muter lagu Balonku,DORR nyaa sangat berasa mengguncang Ginjal",2 minggu lalu
supomo,POLYTRON Cinemax Digital TV 24 inch PLD 24TV1855,bintang 5,barang bagus respon cepat sesuai lah tv berfungsi,2 minggu lalu
E***o,POLYTRON Rice Cooker Donabe 2 Liter PRC 1201,bintang 5,"Sesuai deskripsi. Hanya mekanisme penutupnya kurang kokoh, mudah kebuka kembali",2 minggu lalu
d***a,"POLYTRON SMART DIGITAL TV 32""  PLD 32CV1869",bintang 5,"barang original, semoga tv nya awet",2 minggu lalu
David,POLYTRON Professional Active Speaker PAS PRO10F6,bintang 5,keren...................................👍👍👍👍👍👍👍,2 minggu lalu
Shinta,POLYTRON Rice Cooker Donabe 2 Liter PRC 1201,bintang 5,Mantap. Thanks Seller.,2 minggu lalu
Hidayatullah,POLYTRON Multimedia Speaker PMA 9310 /BG,bintang 5,kurir ramah seller ramah pengiriman oke lah not bad real pict,2 minggu lalu
Muhammad,POLYTRON Multimedia Speaker PMA 9310 /BG,bintang 5,"mantaapp barang berfungsi dengan baik, semoga awett, pengiriman langsung dari toko tanpa ekspedisi jadi aman, thanks seller and tokped.",3 minggu lalu
T***i,POLYTRON Mesin Cuci 2 Tabung Primadona Samba 8 Kg PWM 8072,bintang 5,"terbaik, kurirnya baik jug ramah",3 minggu lalu
Yuli,POLYTRON New Belleza Big Liter Kulkas 2 pintu PRM 430X,bintang 5,"Mantap, Meskipun Kardusnya Basah Dikir (Karena Saat Pengiriman Hujan).. Kulkas Tetap Mulus, Setelah Di Test, Berfungsi Dengan Baik (Lg Coba Buat Es Batu 🤭🤭🤭)

Admin Se... ",3 minggu lalu
Haris,POLYTRON Multimedia Speaker PMA 9527 /BA,bintang 5,Worth for money. Bassnya nendang. Easy bluetooth pairing. Desain cakep. diskon+cashback.,3 minggu lalu
Edy,POLYTRON 4K UHD Smart Cinemax Soundbar Google TV 43 Inch PLD 43BUG5959,bintang 5,"sip, suara dan gambar mantul, sempet bandingin sama produk luar tp lbh baik produk lokal sih",3 minggu lalu
Dian,POLYTRON Mesin Cuci 2 tabung 7Kg Primadona Giant PWM 701,bintang 5,barang okeee minusnya pengiriman lama padahal 1 wilayah. mungkin kaarna kurir toko langsung,3 minggu lalu
M***d,4K android box Memory 3+32 GB Free Mola 12 Bulan Play in 4K UHD PDB F1,bintang 5,telah saya terima dalam keadaan baik,3 minggu lalu
R***i,POLYTRON Mesin Cuci 2 Tabung Giant Series Hijab 9 KG PWM 9076,bintang 5,"barang sampai dengan selamat
semoga awet, warnanya cantik banget syukak pokoknya",3 minggu lalu
I***n,POLYTRON Smart Android TV 32 inch PLD 32AG5759,bintang 5,bagus pengiriman cepat,3 minggu lalu
R***y,POLYTRON Kulkas 2 Pintu Beauty metal door 210 liter PRB 219,bintang 4,barang berfungsi dengan baik namun ada lecet tergores di bagian belakang,3 minggu lalu
