Nama Pengguna,Produk,Rating,Ulasan,Tanggal
wahyu,POLYTRON Kulkas 1 Pintu Belleza Varia 170 liter PRA 17CRX,bintang 5,"Sesuai deskripsi , hanya di pengiriman saja yang agak lama 😅",1 bulan lalu
ignatius,POLYTRON DIGITAL TV 24 Inch PLD 24V1853,bintang 5,"barang bagus, sesuai pesan",1 bulan lalu
A***i,"POLYTRON SMART DIGITAL TV 32""  PLD 32CV1869",bintang 5,mitra terbaik,1 bulan lalu
Hermin,POLYTRON Smart Android TV 32 inch PLD 32AG5759,bintang 5,mantappp,1 bulan lalu
otikartika,POLYTRON Kulkas 1 Pintu Belleza 170 liter PRA 17DMY,bintang 4,semua berfungsi dengan baik dapat garansi juga,1 bulan lalu
Zufar,POLYTRON Kulkas 2 Pintu Belleza Jumbo 260 Liter PRW 29Z,bintang 5,"Produk sesuai, seler Responsif.",1 bulan lalu
SUTANDAR,POLYTRON DIGITAL TV 24 Inch PLD 24V1853,bintang 5,terima kasih 👍😊,1 bulan lalu
Denny,POLYTRON HiFi Speaker AUDIVO PHS 6A,bintang 5,"packing rapi, barang bagus, suaranya jernih basnya ajib👍👍",1 bulan lalu
S***n,POLYTRON Mesin Cuci 2 Tabung Giant Series Hijab 10 KG PWM 1076,bintang 5,Baguss sihh mesin cucinya. beneran seirit itu listriknya. giling sama ngeringinnya sama sama kenceng walaupun irit listrik. Terbaik buat Polytron 👍🏻,1 bulan lalu
Samsul,"POLYTRON SMART DIGITAL TV 32""  PLD 32CV1869",bintang 5,mntap,1 bulan lalu
Avit,POLYTRON Cinemax Digital TV 24 inch PLD 24TV1855,bintang 5,ok,1 bulan lalu
M***d,POLYTRON Dispenser Galon Bawah Hydra dengan UV PWC 778UV,bintang 5,"Barang asli, bergaransi. Prosesnya cepat.",1 bulan lalu
R***d,POLYTRON Kulkas 1 Pintu Beauty metal door 150 liter PRB 159,bintang 5,mantab barang sesuai spek dan bagus,1 bulan lalu
Vista,POLYTRON Kulkas 2 Pintu 260 Liter Inverter Belleza JUMBO PRW 29VX,bintang 5,Good Product,1 bulan lalu
S***o,POLYTRON Multimedia Speaker PMA 9310 /BG,bintang 4,"Sesuai pesanan, cuma ada penyok dikit gapapa lah",1 bulan lalu
Rina,POLYTRON Bluetooth Speaker PMA 9310 /BG,bintang 5,"kualitas produk OK utk speaker harga 500rban, suara OK, dpt diskon banyak dr tokped, menyenangkan, hepiii, pengiriman cukup cepat",1 bulan lalu
Ridwan,POLYTRON Smart Cinemax Soundbar TV 32 inch PLD 32BAG9858,bintang 3,sampenya lama. karena pakai kurir toko...,1 bulan lalu
d***a,POLYTRON Multimedia Speaker PMA 9527 /BA,bintang 5,sesuai ekspetasi.. suara mantap.. cocok banget untuk dalam kamar.. seandainya middle dikasi yg lebih besar pasti lebih mantap lg.. thanks polytron..,1 bulan lalu
Yana,Polytron AC Deluxe 2 1 PK PAC 09VH,bintang 5,akhirnya setelah sekian lama. semoga awet,1 bulan lalu
B***a,POLYTRON Multimedia Speaker PMA 9522 /B,bintang 5,"pengiriman sangat cepat dan aman

kualitas produk baik

seller komunikatif

sangat direkomendasikan",1 bulan lalu
Kairos,POLYTRON Kulkas 1 Pintu Belleza 170 liter PRA 17DMY,bintang 5,good job. produk memuaskan,1 bulan lalu
C,Polytron AC Deluxe 2 1/2 PK PAC 05VH,bintang 5,luar biasa dingin.. mantaappp berkualitas..,1 bulan lalu
narman,POLYTRON Mesin Cuci 2 Tabung Giant Series Hijab 10 KG PWM 1076,bintang 5,mantaaaap sesuai ekspektasi,1 bulan lalu
n,POLYTRON Professional Active Speaker PAS PRO10F6,bintang 5,barang sudah sampai dgn selamat..respon seller cepat...barang berfungsi dgn baik makasih,1 bulan lalu
A***a,POLYTRON Kulkas 2 Pintu Belleza JUMBO 260 Liter PRW 29MN,bintang 4,"Pengiriman nya lumayan cepet pesen tgl 3 sampe nya tgl 7, barang mulus tidak ada lecet, cuma pas dtg dalam kondisi hujan dan pengiriman tidak pakai mobil box. Semoga awet",1 bulan lalu
J***i,"POLYTRON DIGITAL LED TV 32"" PLD 32V1853",bintang 5,oke bingirsssssss,1 bulan lalu
M***u,POLYTRON Kulkas 2 Pintu Metallic 240 liter PRW 252T,bintang 3,pengiriman 11 hari,1 bulan lalu
h***a,POLYTRON Dispenser Galon Bawah PWC 615,bintang 5,Pengiriman luaaaammaaaaa... Tp brg bagus,1 bulan lalu
Fitri,POLYTRON Mesin Cuci 1 Tabung Zeromatic series Hijab 9.5 KG PAW 9527,bintang 5,sejauh ini produk berfungsi cm terkendala di selang air yg kurang panjang,1 bulan lalu
F***s,POLYTRON Mesin Cuci 2 Tabung Giant Series 8 KG PWM 8073,bintang 5,"Barang di terima dengan kondisi sangat baikk, semoga awet tidak ada kendala....",1 bulan lalu
Ahmad,POLYTRON Mesin cuci 2 tabung Primadona Giant hijab 10 Kg PWM 1082,bintang 5,"pengiriman cepat,packing aman lintas provinsi karena diproses dihari kerja jadi 1minggu sampenya btw freeongkir dari official store aman di kirim cargoo...top Fiturnya ca... ",1 bulan lalu
Ade,POLYTRON Smart Cinemax Soundbar TV 32 inch PLD 32BAG9858,bintang 4,"barang oke, namun pengiriman lambat",1 bulan lalu
Arfandi,Polytron AC SMART Neuva Pro SMART AC 1/2 PK PAC 05VZS,bintang 5,mantaab... ac cepet banget dinginin ruangan,1 bulan lalu
A***a,POLYTRON Mesin Cuci 1 Tabung Zeromatic Laguna Hijab 9 KG PAW 9028,bintang 5,"berfungsin, semoga awet",1 bulan lalu
T***h,"POLYTRON LED TV DIGITAL 43"" PLD 43V8853",bintang 5,Proses pesanan cepat Kualitas suaranya bagus Resolusi gambar tajam 👍,1 bulan lalu
B***o,POLYTRON Bluetooth Speaker PMA 9321 /B,bintang 5,"Produk bagus, recommended banget",1 bulan lalu
Engkos,POLYTRON Smart Cinemax Soundbar TV 32 inch PLD 32BAG9858,bintang 5,"barang yang dikirim sesuai dengan yang di pesan, pengiriman standar 3 hari sampai, hanya saja karena menggunakan kurir toko jd tidak bisa di lacak. 
gambar jernih, suaran... ",1 bulan lalu
W***s,POLYTRON Kulkas 1 Pintu Belleza 180 liter PRA 18Z,bintang 5,"Alhamdulillah barangnya udah sampe dengan aman & gratis ongkir, kurirnya juga ramah. Barang original & berfungsi dengan baik, warnanya juga bagus, semoga awet. Te... ",1 bulan lalu
Asep,POLYTRON Kulkas 1 Pintu Beauty metal door 170 liter PRB 179,bintang 5,Mantap,1 bulan lalu
Asep,POLYTRON Mesin Cuci 1 Tabung Zeromatic Hijab 7.5 KG PAW 75518B,bintang 5,Mantap,1 bulan lalu
R***y,POLYTRON Multimedia Speaker PMA 9321 /B,bintang 5,Alhamdulillah sesuai.,1 bulan lalu
J***s,POLYTRON Kulkas 2 Pintu Beauty Steel 220 liter PRB 237LB,bintang 5,"barang sudah sampai sesuai pesanan, bagus semoga awet, terima kasih seller terima kasih Polytron terimakasih kurir, cuma sedikit minus pesanan tidak bisa ditracking, over... ",1 bulan lalu
Y***r,POLYTRON Mesin Cuci 2 Tabung Giant Series Hijab 7 KG PWM 7076,bintang 5,"barang datang dengan aman
kualitas bagus
normal semua
cuma note nya, lubang filter air mudah lepas kalau dikasih pressure air yang langsung dari Pompa air, jadi filternya... ",1 bulan lalu
Ss,POLYTRON Kulkas 1 Pintu Belleza Varia 170 liter PRA 17CRX,bintang 5,Barangnya original 👍 Ada garansi resmi Desainnya elegan ✨,1 bulan lalu
Viyan,POLYTRON Kulkas 1 Pintu Beauty metal door 170 liter PRB 179,bintang 5,"barang bagus sesuai pesanan,cuma lama banget pengiriman hampir 2 minggu😟",1 bulan lalu
i***l,POLYTRON Smart Cinemax Soundbar TV 32 inch PLD 32BAG9858,bintang 5,"produk ok, cuma pemgiriman tidak bisa ke track tokped",1 bulan lalu
Sandy,POLYTRON Kulkas 1 Pintu Belleza  180 liter PRA 18CMS,bintang 4,"kualitas mantab, harga bersahabat, customer service ok, namun pengiriman lambat dan susah dilacak",1 bulan lalu
Helmy,POLYTRON Mesin Cuci 1 Tabung Zeromatic Laguna Hijab 10 KG PAW 1028,bintang 4,Belum di coba bagaimana masang dan pakainya,1 bulan lalu
Fauzan,POLYTRON Smart Cinemax Soundbar TV 32 inch PLD 32BAG9858,bintang 5,"TV nya bagus, gambarnya jernih, speaker & subwoofer berfungsi dengan baik. Langsung dapat update software pas pertama kali connect ke internet.",1 bulan lalu
R***o,POLYTRON Mesin Cuci 1 Tabung 8 KG PAW 8029Y,bintang 5,"Barang sampai dengan selamat, semoga awet, terimakasih",1 bulan lalu
H***y,POLYTRON Mesin Cuci 1 Tabung Zeromatic Hijab 9 KG PAW 90517,bintang 5,"Pesanan elektronik ketiga. Puas banget karena pengiriman cepat, bebas ongkos kirim dan harga jauh lebih murah dibanding seller lain",1 bulan lalu
Nana,POLYTRON Mesin Cuci 1 Tabung Zeromatic Hijab 7.5 KG PAW 75518B,bintang 5,Oke...,1 bulan lalu
Totok,POLYTRON Kulkas 1 Pintu Beauty Steel 180 liter PRB 187LB,bintang 5,Sesuai pesanan.. mantab..,1 bulan lalu
irwan,POLYTRON Mesin Cuci 1 Tabung Zeromatic Laguna Hijab 8 KG PAW 8028,bintang 5,"Mantap Barang sesuai dg deskripsi, dan sdh di coba mantap,bodi kokoh dan mulus",1 bulan lalu
Restu,POLYTRON Mesin Cuci 2 Tabung Primadona Giant 7 Kg PWM 7072,bintang 5,Ada garansi resmi Penjualnya ramah banget Packaging aman 🙏 Proses pesanan cepat Packaging rapi Respon penjualnya top Barangnya original 👍,1 bulan lalu
Erick,POLYTRON 4K UHD Smart Google TV 55 Inch PLD 55UG5959,bintang 5,Barang okay sesuai deskripsi  garansi 5 tahun coy mantap,1 bulan lalu
c***p,POLYTRON Kulkas 1 Pintu Beauty metal door 180 liter PRB 189,bintang 5,pesanan dikirim dengan dengan sekamet aman👍👍👍👍,1 bulan lalu
Esther,POLYTRON Kulkas 2 Pintu Beauty metal door 210 liter PRB 219,bintang 5,cakep...3 hari setelah pemesanan lsg di anter dan sampai tanpa kendala..terimakasih y,1 bulan lalu
izzuzzulfa,POLYTRON Kulkas 2 Pintu Belleza JUMBO 220 Liter PRW 23MN,bintang 5,bagus dan cepat sampai,1 bulan lalu
A***i,POLYTRON Professional Active Speaker PAS PRO10F6,bintang 5,"Barang ori dari official polytron langsung, pengiriman terbilang cepat, dpt potongan harga dari tokopedia juga, terimakasih Polytron & Tokopedia 🙏🏼😊",1 bulan lalu
Tangkas,POLYTRON Mesin Cuci 2 Tabung Giant Series 8 KG PWM 8073,bintang 5,"ternyata pengirimannya cepat, 3hari sampai dikirim dari toko terdekat, paket diterima dg aman",1 bulan lalu
Agung,POLYTRON Mesin Cuci 1 Tabung Zeromatic Laguna Hijab 8 KG PAW 8028,bintang 4,"Untuk pelayanan toko baik, responsif dalam membantu kendala customer.
Namun saya kecewa dengan jasa kirim yg dipilih toko J*E Trucking yg sangat tidak profesional. Barang... ",1 bulan lalu
ANGGI,POLYTRON Multimedia Speaker PMA 9525 /B,bintang 1,pemakaian 6 BLN udh rusak minta klaim garansi,1 bulan lalu
Novia,POLYTRON Mesin Cuci 1 Tabung Zeromatic Laguna Hijab 8 KG PAW 8028,bintang 5,original dan amanah terimakasih,1 bulan lalu
Eki,Polytron AC Neuva Pro 1 PK PAC 09VZ,bintang 5,Produk Original,1 bulan lalu
ignatius,Polytron Monitor 24 inch Full HD - PMD 24VF9930,bintang 5,"ok banget, pengiriman , barang bagus",1 bulan lalu
N***a,POLYTRON Dispenser Galon Bawah PWC 600,bintang 5,Barang mendarat dengan mulus. Thank Polytron Official Store.,1 bulan lalu
N***a,POLYTRON Primadona Giant Mesin cuci 2 tabung 14 Kg PWM 1403,bintang 5,Barang mendarat dengan mulus. Thank Polytron Official Store,1 bulan lalu
Z***i,POLYTRON Kulkas 1 Pintu Belleza 180 liter PRA 18,bintang 5,alhamdulillah kulkas mendarat dengan baik di sleman dan cepat juga loh. makasih ya seller yang gercep dan ramah.,1 bulan lalu
Arif,POLYTRON Bluetooth Speaker PMA 9525 /B,bintang 5,Mantap,1 bulan lalu
Sunardi,POLYTRON Cinemax Digital TV 24 inch PLD 24TV1855,bintang 5,barang ok banget. recommended dech,1 bulan lalu
S***o,"POLYTRON SMART DIGITAL TV 40"" PLD 40CV8969",bintang 5,"pengiriman 1 minggu, langsung d cek, aman, bagus....terimakasih",1 bulan lalu
a***n,POLYTRON Kulkas 2 Pintu 260 Liter Inverter Belleza JUMBO PRW 29VX,bintang 5,sesuai pesanan real pick semoga awet Terima kasih polytron,1 bulan lalu
HeriS,POLYTRON Kulkas 2 Pintu Metallic 240 liter PRW 252T,bintang 5,luar biasa,1 bulan lalu
Ari,POLYTRON Smart Cinemax Soundbar TV 32 inch PLD 32BAG9858,bintang 5,"berfungsi dg baik, aman, worth it",1 bulan lalu
djoko,POLYTRON 4K UHD Smart Cinemax Soundbar Google TV 50 Inch PLD 50BUG5959,bintang 5,"produk ok, gratis mola dll belum dickba, respon penjual bagus. untuk perbaikan info pengiriman dr awal sdh bisa diinfo ke customer",1 bulan lalu
za,POLYTRON Mesin Cuci 2 tabung 7Kg Primadona Giant PWM 701,bintang 5,barang bagus . cuma pengiriman aja yg lama,1 bulan lalu
I,POLYTRON Mesin Cuci 2 Tabung Giant Series Hijab 7 KG PWM 7076,bintang 3,pengiriman lambat dan meragukan..,1 bulan lalu
W***N,POLYTRON Kulkas 1 Pintu Beauty metal door 170 liter PRB 179,bintang 5,"Barang Bagus.
proses kirim klo bisa di percepat. Waktu pengiriman Sekitar 7 hari (dari Proses order sampe barang di terima di Rumah, Tangerang Kota).",1 bulan lalu
arie,POLYTRON Kulkas 2 Pintu Belleza JUMBO 220 Liter PRW 23MN,bintang 5,bagussw sukaa thanks ya,1 bulan lalu
Y***b,POLYTRON Mesin Cuci Front Loading 100% Kering Inverter 8 KG PFL 8105,bintang 5,"sempat ada kendala, tapi tim polytron gercep mendatangkan teknisi. mantab",1 bulan lalu
Ijang,POLYTRON Mesin Cuci 2 Tabung Giant Series Hijab 10 KG PWM 1076,bintang 5,barang datang dengan selamat. full ori mantap,1 bulan lalu
K***l,POLYTRON Kulkas Mini 50 liter PRH 51X,bintang 5,"mantap, semoga awet",1 bulan lalu
K***a,Polytron AC Deluxe 2 1/2 PK PAC 05VH,bintang 1,"Halo min,, kali ini saya kasih bintang 1 karena ac yg dibeli gak ada freon nya ya. 

solusi yg ditawarkan dr admin official polytron di  tokopedia yg mengharuskan saya me... ",1 bulan lalu
Rahmat,"POLYTRON Cinemax Soundbar DIGITAL LED TV 32"" PLD 32BV1558",bintang 4,"Barang sesuai dengan deskripsi, suaranya ngebass banget, keren, cuma pengiriman aja 1minggu agak lama",1 bulan lalu
weni,POLYTRON Mesin Cuci 2 Tabung Giant Series Hijab 8 KG PWM 8076,bintang 5,"alhamdulillah sudah dicoba,berfungsi dengan baik.semoga produk awet dan untuk ekspedisi indah cargo,pengirimannya benar2 baik dan komunikatif.terimakasih sukses selalu",1 bulan lalu
Ruswantozulfi,POLYTRON Active Speaker PAS 8EF22,bintang 5,Mantappp,1 bulan lalu
T,POLYTRON Kulkas 2 Pintu Beauty metal door 210 liter PRB 219,bintang 5,Barang sampai dalam keadaan bagus,1 bulan lalu
R***n,POLYTRON Dispenser Galon Bawah PWC 615,bintang 5,sempat panik barangnya gk bisa dilacak karena gk ada estumasi tibanya tpi 4 hari setelah pembayaran barang datang.,1 bulan lalu
Wati,POLYTRON Active Speaker PAS 8CF28,bintang 5,"Mantap. Speakernya tidak ada kekurangannya. Semuanya bagus. Terimakasih Seller, Terimakasih TokoPedia, Terimakasih Abang Kurir. 🙏🙏🙏👍👍👍",1 bulan lalu
Dayudi,Polytron AC Neuva Pro 1/2 PK PAC 05VZ,bintang 5,"barang baru dan original, free logistic sampai rumah beneran. terimakasih rekomendasi",1 bulan lalu
Aliimronstore,POLYTRON Smart Cinemax Android TV 43 inch PLD 43TAG9959,bintang 5,trima kasih,1 bulan lalu
EvlinFebriana,"POLYTRON Smart Android TV 43"" PLD 43AG9953",bintang 5,"murah pengiriman cepat 3 hari sampai jatim, meskipun tgl merah tetap dianterrr emang toppp jnt cargoooo,",1 bulan lalu
N***r,POLYTRON Showcase 280 Liter SCN 237,bintang 1,"pengalaman buruk pertama kali beli di official store brand ternama, barang bermasalah tidak berfungsi, rusak. Barang baru unboxing rusak, bermasalah, tidak berfungsi.
krn... ",1 bulan lalu
R***y,POLYTRON Professional Active Speaker PAS PRO15F3,bintang 5,bagus bangeettt,1 bulan lalu
R***G,POLYTRON Smart Cinemax Soundbar TV 32 inch PLD 32BAG9858,bintang 5,terimakasih mbak...,1 bulan lalu
Irfan,POLYTRON Multimedia Speaker PMA 9527 /BA,bintang 1,ada bunyik kresek kresek,1 bulan lalu
Suhendra,POLYTRON Kulkas 1 Pintu Belleza 180 liter PRA 18,bintang 5,"barang bagus dan sesuai sma yg saya pesan, tidak ada cacat atau kerusakan",1 bulan lalu
Habi,POLYTRON Active Speaker PAS 8EF28,bintang 5,puas sm Polytron,1 bulan lalu
Saiman,POLYTRON 4K UHD Smart Google TV 43 Inch PLD 43UG5959,bintang 5,"Barang mantap di antar pas malem thn baru cuaca hujan cocok langsung di tes, semoga awet jd gak perlu garansi 😀",1 bulan lalu
Rani,POLYTRON Kulkas Mini 50 liter PRH 51R,bintang 5,"barang sampai dengan selamat.. 
barang dapat digunakan dengan baik
terima kasih Polytron.. semoga makin jaya",1 bulan lalu
Dody,POLYTRON Multimedia Speaker PMA 9527 /BA,bintang 5,Bagus produknya. Semoga awet,1 bulan lalu
B***i,POLYTRON Kulkas 1 Pintu Belleza  180 liter PRA 18CMS,bintang 1,"kulkas baru tp kyak bekas, kotor, pintu tdk rapat dan sudah kebanting bengkok bagian belakang. sepertinya barang display/reject dijual online. bela2in beli di officialsto... ",1 bulan lalu
Andhika,POLYTRON Smart Cinemax Android TV 43 inch PLD 43TAG9959,bintang 5,"Barang jaminan ori, tp antar nya aja yg agak lama sih. overall ok",1 bulan lalu
Yogo,POLYTRON Kulkas 2 Pintu Belleza 240 liter PRM 28CMS,bintang 4,Warna di luar expektasi sih. Cuma sesuai harga. Bahan serba plastik saat ini. Tidak keliatan mewah. Saran yang mau beli mending pilih kulkas yg lebih mahal yg ada inverte... ,1 bulan lalu
h***l,POLYTRON Mesin Cuci 2 Tabung Giant Series 7 KG PWM 7073,bintang 5,"Produk bagus, harga ekonomis, semoga awet, pengiriman ok, respon cepat. Terima kasih.",1 bulan lalu
A***n,"POLYTRON Cinemax Digital LED TV 32"" PLD 32TV1855",bintang 5,Belum dibuka positive thinking aja,1 bulan lalu
Valentine,POLYTRON Kulkas 1 Pintu Belleza 180 liter PRA 18,bintang 5,Barang aman sampai rumah. Admin responsible.,1 bulan lalu
G***t,POLYTRON Multimedia Speaker PMA 9527 /BA,bintang 5,"desain barang bagus, kualitas suara lebih bagus dr seri di bawah nya",1 bulan lalu
a***o,POLYTRON Showcase 280 Liter SCN 238X,bintang 5,"Thankyou
barang sampai dengan aman, walaupun sampe rumah jam 2 malem. Yg penting aman 
thank's",1 bulan lalu
Abdul,POLYTRON Active Speaker PAS 8EF28,bintang 5,walaupun ga sesuai pesanan barang yg dikirim. semoga awet,1 bulan lalu
Ibnu,POLYTRON Kulkas 2 Pintu Beauty metal door 210 liter PRB 219,bintang 5,kulkasnya okeh bagus tapi emang lama dikirimnya doang,1 bulan lalu
M***d,POLYTRON Kulkas 1 Pintu Belleza 160 liter PRA 16DMY,bintang 1,buat pengalaman aja beli barang seperti ini dan sejenis nya lebih baik ke toko offline saja. besi bawah tidak rata bekas hancur dari sana di tempel lakban silver biar tid... ,1 bulan lalu
parhan,POLYTRON Kulkas 2 Pintu Side By Side 450 liter PRS 455S,bintang 4,"sudah beberapa hari sampai dan dipakai barang nya berkerja secara normal.

paling kendala sedikit di third party kurir yang dipake toko ini aja.
tidak jelas informasi yan... ",1 bulan lalu
Maximus,"POLYTRON SMART DIGITAL TV 24""  PLD 24CV1869",bintang 5,Produk sampai dalam keadaan lengkap dan tanpa cacat sesuai pesanan. Terima kasih.,1 bulan lalu
T***i,POLYTRON Kulkas 2 Pintu Side By Side 450 liter PRS 455S,bintang 5,"kulkas nya bagus sesuai harapan, material kokoh tebel mantep pokoknya",1 bulan lalu
Hermawan,Polytron Speaker PPB W05A6,bintang 5,Suaranya mantap 🔊 Kualitas boleh diadu Desain elegan Bahannya kokoh Proses pesanan cepat,1 bulan lalu
rexi,POLYTRON Multimedia Speaker PMA 9522 /B,bintang 5,"barang sesuai , real pick, semoga awett",1 bulan lalu
R***a,POLYTRON Dispenser Galon Bawah PWC 500,bintang 5,"mantap berfungsi kualitas ok,aman smpai tujuan,pengiriman bisa di dikordinasikan",1 bulan lalu
Eni,POLYTRON Mesin Cuci 1 Tabung Zeromatic Laguna Hijab 8 KG PAW 8028,bintang 5,"barang keadaan baik, pengiriman cepat, semoga awet",1 bulan lalu
ipin,POLYTRON Mesin Cuci 2 Tabung Giant Series Hijab 8 KG PWM 8076,bintang 5,"terbaik, mesin cuci normal semua terimakasih",1 bulan lalu
Kirana,POLYTRON Kulkas 1 Pintu Belleza 180 liter PRA 18,bintang 5,"Motifnya sesuai dan cantikk , berfungsi dengan baik, semoga awet dan yg lebih penting cepet banget pengirimannya (pertahankan)",1 bulan lalu
Sebastian,POLYTRON Multimedia Speaker PMA 9527 /BA,bintang 5,"pma9527 kualitas bagus, tapi pengiriman tolong diperbaiki, trims",1 bulan lalu
ita,POLYTRON Smart Cinemax Android TV 43 inch PLD 43TAG9959,bintang 5,"mantap lah semoga awet, pengiriman jga cepat ternyata",1 bulan lalu
Diyan,POLYTRON 4K UHD Smart Cinemax Soundbar Google TV 43 Inch PLD 43BUG5959,bintang 5,"Barang bagus, Pengiriman Cepat, Harga Murah... Support Local..👍",1 bulan lalu
Hendro,Polytron AC Neuva Pro 1/2 PK PAC 05VZ,bintang 1,untuk barang tidak ada masalah tapi buat yang belum ada pengalaman jasa pasang ac sebaiknya jangan beli yang jual unitnya saja tapi beli yang sepaket dengan instalasi kar... ,1 bulan lalu
R***y,POLYTRON Mesin Cuci 1 Tabung Zeromatic Hijab 7.5 KG PAW 75518B,bintang 5,Barang ok dan mulus....namun untuk saran proses pengiriman agar lebih disinkronkan supaya tidak terjadi Miss komunikasi antara pembeli dan penjual,1 bulan lalu
rexi,POLYTRON Multimedia Speaker PMA 9522 /B,bintang 5,"barang sesuai , real pick, semoga awett",1 bulan lalu
R***a,POLYTRON Dispenser Galon Bawah PWC 500,bintang 5,"mantap berfungsi kualitas ok,aman smpai tujuan,pengiriman bisa di dikordinasikan",1 bulan lalu
Eni,POLYTRON Mesin Cuci 1 Tabung Zeromatic Laguna Hijab 8 KG PAW 8028,bintang 5,"barang keadaan baik, pengiriman cepat, semoga awet",1 bulan lalu
ipin,POLYTRON Mesin Cuci 2 Tabung Giant Series Hijab 8 KG PWM 8076,bintang 5,"terbaik, mesin cuci normal semua terimakasih",1 bulan lalu
Kirana,POLYTRON Kulkas 1 Pintu Belleza 180 liter PRA 18,bintang 5,"Motifnya sesuai dan cantikk , berfungsi dengan baik, semoga awet dan yg lebih penting cepet banget pengirimannya (pertahankan)",1 bulan lalu
Sebastian,POLYTRON Multimedia Speaker PMA 9527 /BA,bintang 5,"pma9527 kualitas bagus, tapi pengiriman tolong diperbaiki, trims",1 bulan lalu
ita,POLYTRON Smart Cinemax Android TV 43 inch PLD 43TAG9959,bintang 5,"mantap lah semoga awet, pengiriman jga cepat ternyata",1 bulan lalu
Diyan,POLYTRON 4K UHD Smart Cinemax Soundbar Google TV 43 Inch PLD 43BUG5959,bintang 5,"Barang bagus, Pengiriman Cepat, Harga Murah... Support Local..👍",1 bulan lalu
Hendro,Polytron AC Neuva Pro 1/2 PK PAC 05VZ,bintang 1,untuk barang tidak ada masalah tapi buat yang belum ada pengalaman jasa pasang ac sebaiknya jangan beli yang jual unitnya saja tapi beli yang sepaket dengan instalasi kar... ,1 bulan lalu
R***y,POLYTRON Mesin Cuci 1 Tabung Zeromatic Hijab 7.5 KG PAW 75518B,bintang 5,Barang ok dan mulus....namun untuk saran proses pengiriman agar lebih disinkronkan supaya tidak terjadi Miss komunikasi antara pembeli dan penjual,1 bulan lalu
